SQL> select * from student;

     REGNO NAME  MAJOR BDATE
---------- ----- ----- ---------
        12 avd   sfg   01-NOV-17
        13 thu   jki   02-NOV-17
        14 erg   gth   03-NOV-17
        16 efr   fgt   04-NOV-17
        17 dfr   cvr   05-NOV-17
        18 aaa   bbb   06-NOV-17

6 rows selected.

SQL> savepoint here;

Savepoint created.

SQL> delete from student where regno=18;

1 row deleted.

SQL> select * from student;

     REGNO NAME  MAJOR BDATE
---------- ----- ----- ---------
        12 avd   sfg   01-NOV-17
        13 thu   jki   02-NOV-17
        14 erg   gth   03-NOV-17
        16 efr   fgt   04-NOV-17
        17 dfr   cvr   05-NOV-17

SQL> rollback to here;

Rollback complete.

SQL> select * from student;

     REGNO NAME  MAJOR BDATE
---------- ----- ----- ---------
        12 avd   sfg   01-NOV-17
        13 thu   jki   02-NOV-17
        14 erg   gth   03-NOV-17
        16 efr   fgt   04-NOV-17
        17 dfr   cvr   05-NOV-17
        18 aaa   bbb   06-NOV-17

6 rows selected.

SQL> commit;

Commit complete.
